{
  "$schema": "http://json-schema.org/draft-07/schema#",
  "title": "Shared Dependencies Schema",
  "description": "Defines the structure for shared_deps.json, which outlines shared dependencies between different parts of a system.",
  "type": "object",
  "properties": {
    "domElementIds": {
      "type": "array",
      "items": {
        "type": "string"
      },
      "description": "A list of DOM element IDs that are shared or relied upon."
    },
    "functionSignatures": {
      "type": "array",
      "items": {
        "type": "object",
        "properties": {
          "name": {
            "type": "string",
            "description": "The name of the function."
          },
          "description": {
            "type": "string",
            "description": "An optional description of what the function does."
          },
          "parameters": {
            "type": "array",
            "items": {
              "type": "object",
              "properties": {
                "name": {
                  "type": "string",
                  "description": "The name of the parameter."
                },
                "type": {
                  "type": "string",
                  "description": "The data type of the parameter."
                },
                "description": {
                  "type": "string",
                  "description": "An optional description of the parameter."
                }
              },
              "required": ["name", "type"]
            },
            "description": "An array detailing the function's parameters."
          },
          "returns": {
            "type": "object",
            "properties": {
              "type": {
                "type": "string",
                "description": "The data type of the return value."
              },
              "description": {
                "type": "string",
                "description": "An optional description of the return value."
              }
            },
            "required": ["type"],
            "description": "Details about what the function returns."
          }
        },
        "required": ["name", "parameters", "returns"]
      },
      "description": "An array of objects, each defining a shared function signature."
    },
    "globalVariables": {
      "type": "array",
      "items": {
        "type": "object",
        "properties": {
          "name": {
            "type": "string",
            "description": "The name of the global variable."
          },
          "type": {
            "type": "string",
            "description": "The data type of the global variable."
          },
          "description": {
            "type": "string",
            "description": "An optional description of the global variable."
          }
        },
        "required": ["name", "type"]
      },
      "description": "An array of objects, each defining a shared global variable."
    },
    "messageNames": {
      "type": "array",
      "items": {
        "type": "object",
        "properties": {
          "name": {
            "type": "string",
            "description": "The name of the message."
          },
          "payloadSchema": {
            "type": "object",
            "description": "An optional JSON schema defining the structure of the message payload."
          },
          "description": {
            "type": "string",
            "description": "An optional description of the message and its purpose."
          }
        },
        "required": ["name"]
      },
      "description": "An array of objects, each defining a shared message name and optionally its payload schema."
    },
    "dataSchemas": {
      "type": "object",
      "additionalProperties": {
        "oneOf": [
          { "type": "object" },
          { "type": "string" }
        ]
      },
      "description": "An object where keys are schema names (string) and values are either full JSON schema objects or string descriptions of the data structures."
    },
    "version": {
      "type": "string",
      "description": "The version of this shared dependencies schema (e.g., \"1.0\")."
    },
    "notes": {
      "type": "string",
      "description": "Optional general notes about the shared dependencies."
    }
  },
  "required": [
    "domElementIds",
    "functionSignatures",
    "globalVariables",
    "messageNames",
    "dataSchemas",
    "version"
  ]
}
